{
  "$schema": "../../schemas/lesson.schema.json",
  "id": "economy-02-a-trading-nation",
  "chapter": "Canada's Economy",
  "order": 1,
  "title": {
    "en": "A trading nation",
    "fr": "Une nation commerçante"
  },
  "passages": [
    {
      "id": "e2-always-a-trading-nation",
      "text": {
        "en": "Canada has always traded with other countries, and trade is still what drives its economy to grow.",
        "fr": "Le Canada a toujours fait du commerce avec d'autres pays, et c'est encore le commerce qui fait croître son économie."
      },
      "fact": {
        "factual": true,
        "source": {
          "sourceId": "discover-canada",
          "chapter": "Canada's Economy",
          "page": 90,
          "url": "https://www.canada.ca/en/immigration-refugees-citizenship/corporate/publications-manuals/discover-canada.html",
          "sourceHash": "fd51046981916115cc39b989e9eedd3ab2c5943aeb7e0fe4e237e13a0da7c836",
          "asOf": "2026-09-08T00:00:00Z",
          "volatile": false,
          "quote": "Canada has always been a trading nation and commerce remains the engine of economic growth."
        },
        "verification": {
          "status": "verified",
          "model": "claude-opus-5-5",
          "checkedAt": "2026-09-23T22:11:00Z",
          "sourceHash": "fd51046981916115cc39b989e9eedd3ab2c5943aeb7e0fe4e237e13a0da7c836",
          "evidence": "Canada has always been a trading nation and commerce remains the engine of economic growth."
        }
      }
    },
    {
      "id": "e2-trade-keeps-our-standard-of-living",
      "text": {
        "en": "Without trade with other countries, Canadians could not keep the standard of living they have.",
        "fr": "Sans le commerce avec d'autres pays, les Canadiens ne pourraient pas garder le niveau de vie qu'ils ont."
      },
      "fact": {
        "factual": true,
        "source": {
          "sourceId": "discover-canada",
          "chapter": "Canada's Economy",
          "page": 90,
          "url": "https://www.canada.ca/en/immigration-refugees-citizenship/corporate/publications-manuals/discover-canada.html",
          "sourceHash": "fd51046981916115cc39b989e9eedd3ab2c5943aeb7e0fe4e237e13a0da7c836",
          "asOf": "2026-09-08T00:00:00Z",
          "volatile": false,
          "quote": "As Canadians, we could not maintain our standard of living without engaging in trade with other nations."
        },
        "verification": {
          "status": "verified",
          "model": "claude-opus-5-5",
          "checkedAt": "2026-09-23T22:11:00Z",
          "sourceHash": "fd51046981916115cc39b989e9eedd3ab2c5943aeb7e0fe4e237e13a0da7c836",
          "evidence": "As Canadians, we could not maintain our standard of living without engaging in trade with other nations."
        }
      }
    },
    {
      "id": "e2-free-trade-in-1988",
      "text": {
        "en": "In 1988, Canada brought in free trade with the United States.",
        "fr": "En 1988, le Canada a instauré le libre-échange avec les États-Unis."
      },
      "fact": {
        "factual": true,
        "source": {
          "sourceId": "discover-canada",
          "chapter": "Canada's Economy",
          "page": 90,
          "url": "https://www.canada.ca/en/immigration-refugees-citizenship/corporate/publications-manuals/discover-canada.html",
          "sourceHash": "fd51046981916115cc39b989e9eedd3ab2c5943aeb7e0fe4e237e13a0da7c836",
          "asOf": "2026-09-08T00:00:00Z",
          "volatile": false,
          "quote": "In 1988, Canada enacted free trade with the United States."
        },
        "verification": {
          "status": "verified",
          "model": "claude-opus-5-5",
          "checkedAt": "2026-09-23T22:11:00Z",
          "sourceHash": "fd51046981916115cc39b989e9eedd3ab2c5943aeb7e0fe4e237e13a0da7c836",
          "evidence": "In 1988, Canada enacted free trade with the United States."
        }
      }
    },
    {
      "id": "e2-mexico-joins-in-1994",
      "text": {
        "en": "In 1994, Mexico became a partner too, in a wider free trade agreement.",
        "fr": "En 1994, le Mexique est lui aussi devenu partenaire, dans le cadre d'un accord de libre-échange plus large."
      },
      "fact": {
        "factual": true,
        "source": {
          "sourceId": "discover-canada",
          "chapter": "Canada's Economy",
          "page": 90,
          "url": "https://www.canada.ca/en/immigration-refugees-citizenship/corporate/publications-manuals/discover-canada.html",
          "sourceHash": "fd51046981916115cc39b989e9eedd3ab2c5943aeb7e0fe4e237e13a0da7c836",
          "asOf": "2026-09-08T00:00:00Z",
          "volatile": false,
          "quote": "Mexico became a partner in 1994 in the broader North American Free Trade Agreement (NAFTA)"
        },
        "verification": {
          "status": "verified",
          "model": "claude-opus-5-5",
          "checkedAt": "2026-09-23T22:11:00Z",
          "sourceHash": "fd51046981916115cc39b989e9eedd3ab2c5943aeb7e0fe4e237e13a0da7c836",
          "evidence": "In 1988, Canada enacted free trade with the United States. Mexico became a partner in 1994 in the broader North American Free Trade Agreement (NAFTA)"
        }
      }
    },
    {
      "id": "e2-one-of-ten-largest-economies",
      "text": {
        "en": "Today, Canada's economy is one of the ten biggest in the world.",
        "fr": "Aujourd'hui, l'économie du Canada est l'une des dix plus grandes du monde."
      },
      "fact": {
        "factual": true,
        "source": {
          "sourceId": "discover-canada",
          "chapter": "Canada's Economy",
          "page": 90,
          "url": "https://www.canada.ca/en/immigration-refugees-citizenship/corporate/publications-manuals/discover-canada.html",
          "sourceHash": "fd51046981916115cc39b989e9eedd3ab2c5943aeb7e0fe4e237e13a0da7c836",
          "asOf": "2026-09-08T00:00:00Z",
          "volatile": true,
          "quote": "Today, Canada has one of the ten largest economies in the world"
        },
        "verification": {
          "status": "verified",
          "model": "claude-opus-5-5",
          "checkedAt": "2026-09-23T22:11:00Z",
          "sourceHash": "fd51046981916115cc39b989e9eedd3ab2c5943aeb7e0fe4e237e13a0da7c836",
          "evidence": "Today, Canada has one of the ten largest economies in the world"
        }
      }
    }
  ]
}
